{
  "candidate": {
    "bundle_digest": "sha256:84a6012391531b4634ba201101ffd8d754be6c62345af3910d4d11f3bdfb62ec",
    "source_revision": "96c63359b3e79c8147d64dc6250a0de0968eb061",
    "version": "0.28.0",
    "wheel_sha256": "551e171fca36d3496d73edc1f83604e28e68a103fcde326f539315bb1072a295"
  },
  "profile_evidence": {
    "profiler": "scalene 2.3.0",
    "run_id": "20260727T172707Z-448eeb97",
    "status": "attribution_only"
  },
  "runs": [
    {
      "accuracy": 0.0,
      "candidate_digest": "sha256:84a6012391531b4634ba201101ffd8d754be6c62345af3910d4d11f3bdfb62ec",
      "candidate_registration": "codex-usage-tracker@codex-usage-tracker:0.28.0",
      "candidate_version": "0.28.0",
      "catalog_observed": true,
      "catalog_tools": [
        "usage_status",
        "usage_refresh",
        "usage_query",
        "usage_evidence",
        "usage_allowance",
        "usage_job_status"
      ],
      "claim_grades": [
        "fact",
        "unsupported"
      ],
      "error_code": "oracle_mismatch",
      "exposure_observed": true,
      "final_answer_ms": 111029.71,
      "first_tool_ms": 47138.319,
      "fresh_task": true,
      "generation": 2,
      "handshake_observed": true,
      "host": "codex_cli",
      "host_version": "codex-cli 0.146.0-alpha.3.1",
      "human_labels": true,
      "launch_method": "codex_exec_ephemeral",
      "mcp_calls": 2,
      "polls": 0,
      "prompt_id": "allowance_drain",
      "query_batches": 0,
      "refresh_joins": 0,
      "refresh_starts": 0,
      "registration_observed": true,
      "response_bytes": 265027,
      "retries": 0,
      "scenario": "warm_generation",
      "selector_validity": "not_applicable",
      "success": true,
      "terminal_state": "completed",
      "tracker_ms": 44722.699,
      "usefulness": 2
    },
    {
      "accuracy": 0.0,
      "candidate_digest": "sha256:84a6012391531b4634ba201101ffd8d754be6c62345af3910d4d11f3bdfb62ec",
      "candidate_registration": "codex-usage-tracker@codex-usage-tracker:0.28.0",
      "candidate_version": "0.28.0",
      "catalog_observed": true,
      "catalog_tools": [
        "usage_status",
        "usage_refresh",
        "usage_query",
        "usage_evidence",
        "usage_allowance",
        "usage_job_status"
      ],
      "claim_grades": [
        "fact"
      ],
      "error_code": "oracle_mismatch",
      "exposure_observed": true,
      "final_answer_ms": 103560.39,
      "first_tool_ms": 50261.347,
      "fresh_task": true,
      "generation": 2,
      "handshake_observed": true,
      "host": "codex_cli",
      "host_version": "codex-cli 0.146.0-alpha.3.1",
      "human_labels": true,
      "launch_method": "codex_exec_ephemeral",
      "mcp_calls": 3,
      "polls": 0,
      "prompt_id": "evidence_timeline",
      "query_batches": 1,
      "refresh_joins": 0,
      "refresh_starts": 0,
      "registration_observed": true,
      "response_bytes": 4276,
      "retries": 0,
      "scenario": "warm_generation",
      "selector_validity": 0.0,
      "success": true,
      "terminal_state": "completed",
      "tracker_ms": 4312.43,
      "usefulness": 3
    },
    {
      "accuracy": 0.0,
      "candidate_digest": "sha256:84a6012391531b4634ba201101ffd8d754be6c62345af3910d4d11f3bdfb62ec",
      "candidate_registration": "codex-usage-tracker@codex-usage-tracker:0.28.0",
      "candidate_version": "0.28.0",
      "catalog_observed": true,
      "catalog_tools": [
        "usage_status",
        "usage_refresh",
        "usage_query",
        "usage_evidence",
        "usage_allowance",
        "usage_job_status"
      ],
      "claim_grades": [],
      "error_code": "agent_task_failed",
      "exposure_observed": true,
      "final_answer_ms": 120099.202,
      "first_tool_ms": 49356.467,
      "fresh_task": true,
      "generation": null,
      "handshake_observed": true,
      "host": "codex_cli",
      "host_version": "codex-cli 0.146.0-alpha.3.1",
      "human_labels": false,
      "launch_method": "codex_exec_ephemeral",
      "mcp_calls": 2,
      "polls": 0,
      "prompt_id": "expensive_thread_calls",
      "query_batches": 1,
      "refresh_joins": 0,
      "refresh_starts": 0,
      "registration_observed": true,
      "response_bytes": 24935,
      "retries": 0,
      "scenario": "warm_generation",
      "selector_validity": 0.0,
      "success": false,
      "terminal_state": "failed",
      "tracker_ms": 1240.933,
      "usefulness": 0
    },
    {
      "accuracy": 0.0,
      "candidate_digest": "sha256:84a6012391531b4634ba201101ffd8d754be6c62345af3910d4d11f3bdfb62ec",
      "candidate_registration": "codex-usage-tracker@codex-usage-tracker:0.28.0",
      "candidate_version": "0.28.0",
      "catalog_observed": true,
      "catalog_tools": [
        "usage_status",
        "usage_refresh",
        "usage_query",
        "usage_evidence",
        "usage_allowance",
        "usage_job_status"
      ],
      "claim_grades": [
        "fact"
      ],
      "error_code": "oracle_mismatch",
      "exposure_observed": true,
      "final_answer_ms": 87494.276,
      "first_tool_ms": 50973.005,
      "fresh_task": true,
      "generation": 2,
      "handshake_observed": true,
      "host": "codex_cli",
      "host_version": "codex-cli 0.146.0-alpha.3.1",
      "human_labels": false,
      "launch_method": "codex_exec_ephemeral",
      "mcp_calls": 2,
      "polls": 0,
      "prompt_id": "four_token_classes",
      "query_batches": 1,
      "refresh_joins": 0,
      "refresh_starts": 0,
      "registration_observed": true,
      "response_bytes": 1906,
      "retries": 0,
      "scenario": "warm_generation",
      "selector_validity": "not_applicable",
      "success": true,
      "terminal_state": "completed",
      "tracker_ms": 2301.478,
      "usefulness": 3
    },
    {
      "accuracy": 0.0,
      "candidate_digest": "sha256:84a6012391531b4634ba201101ffd8d754be6c62345af3910d4d11f3bdfb62ec",
      "candidate_registration": "codex-usage-tracker@codex-usage-tracker:0.28.0",
      "candidate_version": "0.28.0",
      "catalog_observed": true,
      "catalog_tools": [
        "usage_status",
        "usage_refresh",
        "usage_query",
        "usage_evidence",
        "usage_allowance",
        "usage_job_status"
      ],
      "claim_grades": [],
      "error_code": "agent_task_failed",
      "exposure_observed": true,
      "final_answer_ms": 120009.52,
      "first_tool_ms": 47369.643,
      "fresh_task": true,
      "generation": null,
      "handshake_observed": true,
      "host": "codex_cli",
      "host_version": "codex-cli 0.146.0-alpha.3.1",
      "human_labels": false,
      "launch_method": "codex_exec_ephemeral",
      "mcp_calls": 1,
      "polls": 0,
      "prompt_id": "latest_incremental_change",
      "query_batches": 0,
      "refresh_joins": 0,
      "refresh_starts": 0,
      "registration_observed": true,
      "response_bytes": 450,
      "retries": 0,
      "scenario": "warm_generation",
      "selector_validity": "not_applicable",
      "success": false,
      "terminal_state": "failed",
      "tracker_ms": 12.331,
      "usefulness": 0
    },
    {
      "accuracy": 0.0,
      "candidate_digest": "sha256:84a6012391531b4634ba201101ffd8d754be6c62345af3910d4d11f3bdfb62ec",
      "candidate_registration": "codex-usage-tracker@codex-usage-tracker:0.28.0",
      "candidate_version": "0.28.0",
      "catalog_observed": true,
      "catalog_tools": [
        "usage_status",
        "usage_refresh",
        "usage_query",
        "usage_evidence",
        "usage_allowance",
        "usage_job_status"
      ],
      "claim_grades": [
        "fact",
        "unsupported"
      ],
      "error_code": "QUERY_ROWS_UNAVAILABLE",
      "exposure_observed": true,
      "final_answer_ms": 101345.288,
      "first_tool_ms": 44161.297,
      "fresh_task": true,
      "generation": 2,
      "handshake_observed": true,
      "host": "codex_cli",
      "host_version": "codex-cli 0.146.0-alpha.3.1",
      "human_labels": true,
      "launch_method": "codex_exec_ephemeral",
      "mcp_calls": 2,
      "polls": 0,
      "prompt_id": "model_effort_cost",
      "query_batches": 1,
      "refresh_joins": 0,
      "refresh_starts": 0,
      "registration_observed": true,
      "response_bytes": 13300,
      "retries": 0,
      "scenario": "warm_generation",
      "selector_validity": "not_applicable",
      "success": false,
      "terminal_state": "completed",
      "tracker_ms": 3085.467,
      "usefulness": 1
    },
    {
      "accuracy": 0.0,
      "candidate_digest": "sha256:84a6012391531b4634ba201101ffd8d754be6c62345af3910d4d11f3bdfb62ec",
      "candidate_registration": "codex-usage-tracker@codex-usage-tracker:0.28.0",
      "candidate_version": "0.28.0",
      "catalog_observed": true,
      "catalog_tools": [
        "usage_status",
        "usage_refresh",
        "usage_query",
        "usage_evidence",
        "usage_allowance",
        "usage_job_status"
      ],
      "claim_grades": [
        "fact"
      ],
      "error_code": "oracle_mismatch",
      "exposure_observed": true,
      "final_answer_ms": 66002.309,
      "first_tool_ms": 46163.652,
      "fresh_task": true,
      "generation": 2,
      "handshake_observed": true,
      "host": "codex_cli",
      "host_version": "codex-cli 0.146.0-alpha.3.1",
      "human_labels": true,
      "launch_method": "codex_exec_ephemeral",
      "mcp_calls": 2,
      "polls": 0,
      "prompt_id": "tool_context",
      "query_batches": 1,
      "refresh_joins": 0,
      "refresh_starts": 0,
      "registration_observed": true,
      "response_bytes": 8036,
      "retries": 0,
      "scenario": "warm_generation",
      "selector_validity": "not_applicable",
      "success": true,
      "terminal_state": "completed",
      "tracker_ms": 14.76,
      "usefulness": 3
    },
    {
      "accuracy": 0.0,
      "candidate_digest": "sha256:84a6012391531b4634ba201101ffd8d754be6c62345af3910d4d11f3bdfb62ec",